Description,2001,2002,2003,2004,2005,2004 Q3,2004 Q4,2005 Q1,2005 Q2,2005 Q3,2005 Q4,Line
Rest of the world U.S. private deposits liability,6.8,21.0,22.3,111.3,98.4,79.8,196.6,371.2,-36.4,28.7,30.0,1
Households and nonprofit organizations private foreign deposits asset,0.4,1.3,1.3,6.7,5.9,4.8,11.8,22.3,-2.2,1.7,1.8,2
Nonfarm nonfinancial corporate business private foreign deposits asset,-8.5,4.4,18.3,6.4,34.0,-11.4,37.9,20.7,33.4,56.9,24.9,3
Money market mutual funds private foreign deposits asset,27.8,-6.8,-36.6,7.0,16.2,-34.0,11.4,3.5,55.9,47.8,-42.4,4
Instrument discrepancies private foreign deposits,-12.9,22.3,39.3,91.1,42.3,120.4,135.5,324.7,-123.6,-77.7,45.7,5
